{"goal":"Fix the broken inventory refresh.","files":["Assets/Game/Inventory/InventoryView.cs"],"search":"","done":"The inventory shows the right slots after a refresh.","open":["which screen shows the bug?","since which change?","does it happen in the editor?","does it happen in a build?","which items are affected?","is the grid or the list broken?","should empty slots be hidden?"]}
